title,episode_id,opening_crawl,director,producer,release_date,characters,planets,starships,vehicles,species,created,edited,url,characters_count,planets_count,species_count,vehicles_count,starships_count
A New Hope,4,"It is a period of civil war.  Rebel spaceships, striking  from a hidden base, have won  their first victory against  the evil Galactic Empire.    During the battle, Rebel  spies managed to steal secret  plans to the Empire's  ultimate weapon, the DEATH  STAR, an armored space  station with enough power  to destroy an entire planet.    Pursued by the Empire's  sinister agents, Princess  Leia races home aboard her  starship, custodian of the  stolen plans that can save her  people and restore  freedom to the galaxy....",George Lucas,"Gary Kurtz, Rick McCallum",1977-05-25,"https://swapi.py4e.com/api/people/1/, https://swapi.py4e.com/api/people/2/, https://swapi.py4e.com/api/people/3/...","https://swapi.py4e.com/api/planets/1/, https://swapi.py4e.com/api/planets/2/, https://swapi.py4e.com/api/planets/3/","https://swapi.py4e.com/api/starships/2/, https://swapi.py4e.com/api/starships/3/, https://swapi.py4e.com/api/starships/5/...","https://swapi.py4e.com/api/vehicles/4/, https://swapi.py4e.com/api/vehicles/6/, https://swapi.py4e.com/api/vehicles/7/...","https://swapi.py4e.com/api/species/1/, https://swapi.py4e.com/api/species/2/, https://swapi.py4e.com/api/species/3/...",2014-12-10T14:23:31.880000Z,2014-12-20T19:49:45.256000Z,https://swapi.py4e.com/api/films/1/,18,3,5,4,8
The Empire Strikes Back,5,"It is a dark time for the  Rebellion. Although the Death  Star has been destroyed,  Imperial troops have driven the  Rebel forces from their hidden  base and pursued them across  the galaxy.    Evading the dreaded Imperial  Starfleet, a group of freedom  fighters led by Luke Skywalker  has established a new secret  base on the remote ice world  of Hoth.    The evil lord Darth Vader,  obsessed with finding young  Skywalker, has dispatched  thousands of remote probes into  the far reaches of space....",Irvin Kershner,"Gary Kurtz, Rick McCallum",1980-05-17,"https://swapi.py4e.com/api/people/1/, https://swapi.py4e.com/api/people/2/, https://swapi.py4e.com/api/people/3/...","https://swapi.py4e.com/api/planets/4/, https://swapi.py4e.com/api/planets/5/, https://swapi.py4e.com/api/planets/6/...","https://swapi.py4e.com/api/starships/3/, https://swapi.py4e.com/api/starships/10/, https://swapi.py4e.com/api/starships/11/...","https://swapi.py4e.com/api/vehicles/8/, https://swapi.py4e.com/api/vehicles/14/, https://swapi.py4e.com/api/vehicles/16/...","https://swapi.py4e.com/api/species/1/, https://swapi.py4e.com/api/species/2/, https://swapi.py4e.com/api/species/3/...",2014-12-12T11:26:24.656000Z,2014-12-15T13:07:53.386000Z,https://swapi.py4e.com/api/films/2/,16,4,5,6,9
Return of the Jedi,6,"Luke Skywalker has returned to  his home planet of Tatooine in  an attempt to rescue his  friend Han Solo from the  clutches of the vile gangster  Jabba the Hutt.    Little does Luke know that the  GALACTIC EMPIRE has secretly  begun construction on a new  armored space station even  more powerful than the first  dreaded Death Star.    When completed, this ultimate  weapon will spell certain doom  for the small band of rebels  struggling to restore freedom  to the galaxy...",Richard Marquand,"Howard G. Kazanjian, George Lucas, Rick McCallum",1983-05-25,"https://swapi.py4e.com/api/people/1/, https://swapi.py4e.com/api/people/2/, https://swapi.py4e.com/api/people/3/...","https://swapi.py4e.com/api/planets/1/, https://swapi.py4e.com/api/planets/5/, https://swapi.py4e.com/api/planets/7/...","https://swapi.py4e.com/api/starships/2/, https://swapi.py4e.com/api/starships/3/, https://swapi.py4e.com/api/starships/10/...","https://swapi.py4e.com/api/vehicles/8/, https://swapi.py4e.com/api/vehicles/16/, https://swapi.py4e.com/api/vehicles/18/...","https://swapi.py4e.com/api/species/1/, https://swapi.py4e.com/api/species/2/, https://swapi.py4e.com/api/species/3/...",2014-12-18T10:39:33.255000Z,2014-12-20T09:48:37.462000Z,https://swapi.py4e.com/api/films/3/,20,5,9,8,12
The Phantom Menace,1,"Turmoil has engulfed the  Galactic Republic. The taxation  of trade routes to outlying star  systems is in dispute.    Hoping to resolve the matter  with a blockade of deadly  battleships, the greedy Trade  Federation has stopped all  shipping to the small planet  of Naboo.    While the Congress of the  Republic endlessly debates  this alarming chain of events,  the Supreme Chancellor has  secretly dispatched two Jedi  Knights, the guardians of  peace and justice in the  galaxy, to settle the conflict....",George Lucas,Rick McCallum,1999-05-19,"https://swapi.py4e.com/api/people/2/, https://swapi.py4e.com/api/people/3/, https://swapi.py4e.com/api/people/10/...","https://swapi.py4e.com/api/planets/1/, https://swapi.py4e.com/api/planets/8/, https://swapi.py4e.com/api/planets/9/","https://swapi.py4e.com/api/starships/31/, https://swapi.py4e.com/api/starships/32/, https://swapi.py4e.com/api/starships/39/...","https://swapi.py4e.com/api/vehicles/33/, https://swapi.py4e.com/api/vehicles/34/, https://swapi.py4e.com/api/vehicles/35/...","https://swapi.py4e.com/api/species/1/, https://swapi.py4e.com/api/species/2/, https://swapi.py4e.com/api/species/6/...",2014-12-19T16:52:55.740000Z,2014-12-20T10:54:07.216000Z,https://swapi.py4e.com/api/films/4/,34,3,20,7,5
Attack of the Clones,2,"There is unrest in the Galactic  Senate. Several thousand solar  systems have declared their  intentions to leave the Republic.    This separatist movement,  under the leadership of the  mysterious Count Dooku, has  made it difficult for the limited  number of Jedi Knights to maintain   peace and order in the galaxy.    Senator Amidala, the former  Queen of Naboo, is returning  to the Galactic Senate to vote  on the critical issue of creating  an ARMY OF THE REPUBLIC  to assist the overwhelmed  Jedi....",George Lucas,Rick McCallum,2002-05-16,"https://swapi.py4e.com/api/people/2/, https://swapi.py4e.com/api/people/3/, https://swapi.py4e.com/api/people/6/...","https://swapi.py4e.com/api/planets/1/, https://swapi.py4e.com/api/planets/8/, https://swapi.py4e.com/api/planets/9/...","https://swapi.py4e.com/api/starships/21/, https://swapi.py4e.com/api/starships/32/, https://swapi.py4e.com/api/starships/39/...","https://swapi.py4e.com/api/vehicles/4/, https://swapi.py4e.com/api/vehicles/44/, https://swapi.py4e.com/api/vehicles/45/...","https://swapi.py4e.com/api/species/1/, https://swapi.py4e.com/api/species/2/, https://swapi.py4e.com/api/species/6/...",2014-12-20T10:57:57.886000Z,2014-12-20T20:18:48.516000Z,https://swapi.py4e.com/api/films/5/,40,5,14,11,9
Revenge of the Sith,3,"War! The Republic is crumbling  under attacks by the ruthless  Sith Lord, Count Dooku.  There are heroes on both sides.  Evil is everywhere.    In a stunning move, the  fiendish droid leader, General  Grievous, has swept into the  Republic capital and kidnapped  Chancellor Palpatine, leader of  the Galactic Senate.    As the Separatist Droid Army  attempts to flee the besieged  capital with their valuable  hostage, two Jedi Knights lead a  desperate mission to rescue the  captive Chancellor....",George Lucas,Rick McCallum,2005-05-19,"https://swapi.py4e.com/api/people/1/, https://swapi.py4e.com/api/people/2/, https://swapi.py4e.com/api/people/3/...","https://swapi.py4e.com/api/planets/1/, https://swapi.py4e.com/api/planets/2/, https://swapi.py4e.com/api/planets/5/...","https://swapi.py4e.com/api/starships/2/, https://swapi.py4e.com/api/starships/32/, https://swapi.py4e.com/api/starships/48/...","https://swapi.py4e.com/api/vehicles/33/, https://swapi.py4e.com/api/vehicles/50/, https://swapi.py4e.com/api/vehicles/53/...","https://swapi.py4e.com/api/species/1/, https://swapi.py4e.com/api/species/2/, https://swapi.py4e.com/api/species/3/...",2014-12-20T18:49:38.403000Z,2014-12-20T20:47:52.073000Z,https://swapi.py4e.com/api/films/6/,34,13,20,13,12
The Force Awakens,7,"Luke Skywalker has vanished.  In his absence, the sinister  FIRST ORDER has risen from  the ashes of the Empire  and will not rest until  Skywalker, the last Jedi,  has been destroyed.     With the support of the  REPUBLIC, General Leia Organa  leads a brave RESISTANCE.  She is desperate to find her  brother Luke and gain his  help in restoring peace and  justice to the galaxy.     Leia has sent her most daring  pilot on a secret mission  to Jakku, where an old ally  has discovered a clue to  Luke's whereabouts....",J. J. Abrams,"Kathleen Kennedy, J. J. Abrams, Bryan Burk",2015-12-11,"https://swapi.py4e.com/api/people/1/, https://swapi.py4e.com/api/people/3/, https://swapi.py4e.com/api/people/5/...",https://swapi.py4e.com/api/planets/61/,"https://swapi.py4e.com/api/starships/10/, https://swapi.py4e.com/api/starships/77/",,"https://swapi.py4e.com/api/species/1/, https://swapi.py4e.com/api/species/2/, https://swapi.py4e.com/api/species/3/",2015-04-17T06:51:30.504780Z,2015-12-17T14:31:47.617768Z,https://swapi.py4e.com/api/films/7/,11,1,3,0,2
